{
  "experiment_id": "internships_signal_stack_slideshow_traction_001",
  "job_id": "internships_com_signal_stack_001",
  "objective": "audience_traction",
  "content_family": "student application proof",
  "creative_lane": "image_slideshow",
  "delivery_mode": "native_carousel",
  "hypothesis": "A direct proof-gap hook will earn stronger early velocity and saves than the existing four-signal framing.",
  "control_variant_id": "signal-stack-control",
  "primary_metrics": ["view_velocity", "save_rate", "share_rate", "follow_rate"],
  "variants": [
    {
      "variant_id": "signal-stack-control",
      "label": "Four-signal control",
      "hook": "Before you apply, check these four signals",
      "changed_dimensions": [],
      "audio_plan": {
        "mode": "platform_commercial_music",
        "track_id": null,
        "track_title": null,
        "source_url": null,
        "captured_at": null,
        "region": "US",
        "commercial_use_status": "requires_review",
        "added_at_posting": true,
        "notes": ["Recheck the TikTok Commercial Music Library immediately before posting."]
      },
      "status": "draft"
    },
    {
      "variant_id": "proof-gap-hook",
      "label": "Proof-gap hook",
      "hook": "No experience? Close this proof gap before you apply",
      "changed_dimensions": ["hook", "first_frame"],
      "audio_plan": {
        "mode": "platform_commercial_music",
        "track_id": null,
        "track_title": null,
        "source_url": null,
        "captured_at": null,
        "region": "US",
        "commercial_use_status": "requires_review",
        "added_at_posting": true,
        "notes": ["Use the same approved sound as the control so audio does not become a third changed variable."]
      },
      "status": "draft"
    }
  ],
  "decision_policy": {
    "minimum_checkpoint": "24h",
    "min_repeats_before_pattern": 2,
    "max_changed_dimensions_per_variant": 2,
    "stop_after_non_improving_variants": 2
  },
  "publishing_policy": {
    "manual_only": true,
    "human_approval_required": true,
    "auto_posting_allowed": false
  },
  "notes": ["Traction only; no conversion, lead, or revenue objective is attached."]
}
